<?xml version="1.0" encoding="UTF-8"?>
<!DOCTYPE opencms SYSTEM "http://www.opencms.org/dtd/6.0/opencms-modules.dtd">

<opencms>
    <modules>
    	<module>
    		<name>org.opencms.configuration.TestModule1</name>
    		<nicename><![CDATA[OpenCms configuration test module]]></nicename>
    		<class/>
			<description><![CDATA[A module to test the OpenCms module configuration]]></description>
			<version>1.0</version>
			<authorname><![CDATA[Alexander Kandzior]]></authorname>
			<authoremail><![CDATA[alex@opencms.org]]></authoremail>
			<datecreated>Mon, 12 Jul 2004 11:00:00 GMT+01:00</datecreated>
			<userinstalled>Admin</userinstalled>
			<dateinstalled>Tue, 13 Jul 2004 12:00:00 GMT+01:00</dateinstalled>
			<dependencies>
				<dependency name="org.opencms.configuration.TestModule2" version="2.0" />
			</dependencies>
			<exportpoints>
				<exportpoint uri="/system/modules/org.opencms.configuration.TestModule1/classes" destination="classes/"/>
				<exportpoint uri="/system/modules/org.opencms.configuration.TestModule1/lib" destination="lib/"/>
			</exportpoints>	
			<resources>
				<resource uri="/system/modules/org.opencms.configuration.TestModule1/"/>
			</resources>		
			<parameters>
				<param name="additionalresources">/system/modules/org.opencms.configuration.TestModule1/</param>
				<param name="param1">value1</param>
				<param name="param2">value2</param>
			</parameters>		
            <resourcetypes>
				<type class="org.opencms.file.types.CmsResourceTypeXmlContent">
					<param name="property.create.Title">Test title</param>
					<param name="property.create.template-elements">/system/modules/org.opencms.frontend.templateone.form/pages/form.html</param>
					<param name="resource.type.id">12</param>
					<param name="resource.type.name">article</param>
					<param name="schema">/sites/default/xmlcontent/article.xsd</param>
				</type>	
			</resourcetypes>		
            <explorertypes>
            	<explorertype name="article" key="fileicon.article" icon="article.gif" reference="xmlcontent">
					<newresource uri="newresource_xmlcontent.jsp?newresourcetype=article" order="25"/>
           		</explorertype>	
           </explorertypes>	
    	</module>
    </modules>  
</opencms>    