<?xml version="1.0" encoding="UTF-8"?>
<!DOCTYPE opencms SYSTEM "http://www.opencms.org/dtd/6.0/opencms-modules.dtd">

<opencms>
    <modules>
    	<module>
    		<name>org.opencms.configuration.TestModule1</name>
    		<nicename>OpenCms configuration test module</nicename>
    		<class>org.opencms.module.TestModuleActionImpl</class>
			<description><![CDATA[A module to test the OpenCms module configuration]]></description>
			<version>1.0</version>
			<authorname>Alexander Kandzior</authorname>
			<authoremail>alex@opencms.org</authoremail>
			<datecreated>Min, 19 Jul 2004 09:00:00 CEST</datecreated>
			<userinstalled>Admin</userinstalled>
			<dateinstalled>Mon, 19 Jul 2004 12:00:00 CEST</dateinstalled>
			<dependencies/>
			<exportpoints/>
			<resources>
				<resource uri="/types/"/>
			</resources>		
			<parameters>
				<param name="param1">value1</param>
				<param name="param2">value2</param>
			</parameters>				
    	</module>
    </modules>    
</opencms>    